{
  "versio_esquema": 1,
  "periode": {
    "des_de": "2026-10-01",
    "fins_a": "2027-12-31"
  },
  "fonts": [
    {
      "codi": "imo-2026",
      "organitzacio": "IMO",
      "titol": "2026 Meteor Shower Calendar",
      "url": "https://www.imo.net/files/meteor-shower/cal2026.pdf",
      "any_publicacio": 2025,
      "consultat_el": "2026-10-11"
    },
    {
      "codi": "imo-2027",
      "organitzacio": "IMO",
      "titol": "2027 Meteor Shower Calendar",
      "url": "https://www.imo.net/meteor-shower-calendar-2027/ShCal27s.pdf",
      "any_publicacio": 2026,
      "consultat_el": "2026-10-11"
    },
    {
      "codi": "nasa-eclipsis-2027",
      "organitzacio": "NASA",
      "titol": "Eclipses During 2027",
      "url": "https://eclipse.gsfc.nasa.gov/OH/OH2027.html",
      "consultat_el": "2026-10-11"
    }
  ],
  "fenomens": [
    {
      "codi": "draconids",
      "tipus": "pluja_estels",
      "periodicitat": "anual",
      "publicable_calendari": true,
      "velocitat_km_s": 20,
      "textos": { "ca": {
        "nom": "Dracònids",
        "descripcio": "Pluja lenta d'origen cometari que sol tenir poca activitat, però que alguns anys pot presentar esclats inesperats.",
        "consell_general": "Observeu-la al vespre des d'un lloc fosc i amb una vista àmplia del cel; no cal cap instrument." } }
    },
    {
      "codi": "orionids",
      "tipus": "pluja_estels",
      "periodicitat": "anual",
      "publicable_calendari": true,
      "velocitat_km_s": 66,
      "textos": { "ca": {
        "nom": "Oriònids",
        "descripcio": "Pluja anual de meteors ràpids associada al cometa Halley, amb un màxim habitualment ample.",
        "consell_general": "Busqueu un cel fosc durant la segona meitat de la nit i mireu una zona extensa, lluny de la Lluna." } }
    },
    {
      "codi": "southern-taurids",
      "tipus": "pluja_estels",
      "periodicitat": "anual",
      "publicable_calendari": true,
      "velocitat_km_s": 27,
      "textos": { "ca": {
        "nom": "Tàurids del sud",
        "descripcio": "Pluja de baixa freqüència i activitat molt estesa en el temps, coneguda per produir alguns meteors especialment brillants.",
        "consell_general": "Cal paciència i un cel fosc; és més probable veure algun meteor brillant que una successió intensa." } }
    },
    {
      "codi": "northern-taurids",
      "tipus": "pluja_estels",
      "periodicitat": "anual",
      "publicable_calendari": true,
      "velocitat_km_s": 29,
      "textos": { "ca": {
        "nom": "Tàurids del nord",
        "descripcio": "Component nord del complex de les Tàurids, de taxa baixa i màxim ample, però amb possibilitat de meteors brillants.",
        "consell_general": "Observeu a ull nu una zona gran del cel i assumiu que poden passar força minuts entre meteors." } }
    },
    {
      "codi": "leonids",
      "tipus": "pluja_estels",
      "periodicitat": "anual",
      "publicable_calendari": true,
      "velocitat_km_s": 71,
      "textos": { "ca": {
        "nom": "Leònids",
        "descripcio": "Pluja de meteors molt ràpids que pot variar quan la Terra travessa traces de pols del seu cometa progenitor.",
        "consell_general": "La segona meitat de la nit acostuma a ser la més adequada; deixeu que la vista s'adapti a la foscor." } }
    },
    {
      "codi": "geminids",
      "tipus": "pluja_estels",
      "periodicitat": "anual",
      "publicable_calendari": true,
      "velocitat_km_s": 35,
      "textos": { "ca": {
        "nom": "Gemínids",
        "descripcio": "Una de les pluges anuals més abundants i regulars, amb meteors de velocitat moderada visibles durant bona part de la nit.",
        "consell_general": "Observeu a ull nu des d'un indret fosc i protegit de llums directes; el radiant puja al llarg de la nit." } }
    },
    {
      "codi": "ursids",
      "tipus": "pluja_estels",
      "periodicitat": "anual",
      "publicable_calendari": true,
      "velocitat_km_s": 33,
      "textos": { "ca": {
        "nom": "Úrsids",
        "descripcio": "Pluja boreal de final de desembre, normalment modesta però ben situada per a observadors de l'hemisferi nord.",
        "consell_general": "Abrigueu-vos, trieu un horitzó poc il·luminat i reserveu una estona llarga d'observació." } }
    },
    {
      "codi": "quadrantids",
      "tipus": "pluja_estels",
      "periodicitat": "anual",
      "publicable_calendari": true,
      "velocitat_km_s": 41,
      "textos": { "ca": {
        "nom": "Quadràntids",
        "descripcio": "Pluja intensa de començament d'any amb un màxim relativament curt i un radiant favorable a latituds nord.",
        "consell_general": "Convé observar tan a prop del màxim com sigui possible, perquè l'activitat alta dura menys que en altres pluges." } }
    },
    {
      "codi": "lirids",
      "tipus": "pluja_estels",
      "periodicitat": "anual",
      "publicable_calendari": true,
      "velocitat_km_s": 49,
      "textos": { "ca": {
        "nom": "Lírides",
        "descripcio": "Pluja anual de primavera amb activitat moderada i algun meteor brillant ocasional.",
        "consell_general": "Observeu després de mitjanit des d'un cel fosc i eviteu tenir la Lluna o llums artificials dins del camp de visió." } }
    },
    {
      "codi": "eta-aquariids",
      "tipus": "pluja_estels",
      "periodicitat": "anual",
      "publicable_calendari": true,
      "velocitat_km_s": 66,
      "textos": { "ca": {
        "nom": "Eta Aquàrids",
        "descripcio": "Pluja ràpida associada al cometa Halley, molt activa al sud però amb el radiant baix vista des de Catalunya.",
        "consell_general": "Cal observar poc abans de l'alba, amb l'horitzó est o sud-est ben lliure i sense esperar la taxa ideal anunciada." } }
    },
    {
      "codi": "alpha-capricornids",
      "tipus": "pluja_estels",
      "periodicitat": "anual",
      "publicable_calendari": true,
      "velocitat_km_s": 23,
      "textos": { "ca": {
        "nom": "Alfa Capricòrnids",
        "descripcio": "Pluja estival poc abundant, de meteors lents, que pot oferir bòlids vistosos malgrat la seva taxa baixa.",
        "consell_general": "No espereu molts meteors: observeu amb paciència una àrea àmplia del cel per poder detectar els més brillants." } }
    },
    {
      "codi": "southern-delta-aquariids",
      "tipus": "pluja_estels",
      "periodicitat": "anual",
      "publicable_calendari": true,
      "velocitat_km_s": 41,
      "textos": { "ca": {
        "nom": "Delta Aquàrids del sud",
        "descripcio": "Pluja d'estiu de durada llarga, més favorable a l'hemisferi sud però observable parcialment des de Catalunya.",
        "consell_general": "Observeu de matinada cap a un cel obert al sud; la taxa real serà inferior a la ZHR ideal pel radiant baix." } }
    },
    {
      "codi": "perseids",
      "tipus": "pluja_estels",
      "periodicitat": "anual",
      "publicable_calendari": true,
      "velocitat_km_s": 59,
      "textos": { "ca": {
        "nom": "Perseids",
        "descripcio": "Pluja d'estiu molt activa i popular, amb meteors ràpids i un radiant ben situat des de latituds mitjanes nord.",
        "consell_general": "Observeu estirats i a ull nu des d'un lloc fosc; mirar una zona àmplia separada del radiant facilita veure traces llargues." } }
    },
    {
      "codi": "eclipsi-lunar-penumbral",
      "tipus": "eclipsi_llunar",
      "periodicitat": "ocasional",
      "publicable_calendari": true,
      "textos": { "ca": {
        "nom": "Eclipsi lunar penumbral",
        "descripcio": "La Lluna travessa la penombra de la Terra i perd llum de manera gradual, sense arribar a entrar a l'ombra central.",
        "consell_general": "El canvi pot ser molt subtil; compareu l'aspecte de la Lluna abans i durant el màxim o feu fotografies amb la mateixa exposició." } }
    },
    {
      "codi": "eclipsi-solar-total",
      "tipus": "eclipsi_solar",
      "periodicitat": "ocasional",
      "publicable_calendari": true,
      "textos": { "ca": {
        "nom": "Eclipsi solar total",
        "descripcio": "Eclipsi en què la Lluna cobreix completament el Sol dins la franja de totalitat; des d'altres llocs només se'n veu una fase parcial.",
        "consell_general": "Fora de la totalitat, mireu el Sol només amb ulleres o visors solars conformes amb ISO 12312-2; els instruments necessiten un filtre solar frontal adequat." } }
    }
  ],
  "esdeveniments": [
    {
      "codi": "draconids-2026", "fenomen_codi": "draconids",
      "inici": "2026-10-06T00:00:00Z", "fi": "2026-10-10T23:59:59Z", "maxim": "2026-10-09T12:00:00Z",
      "precisio": { "inici": "dia", "fi": "dia", "maxim": "dia" },
      "rellevant_catalunya": true, "rellevancia": "secundari", "dificultat_observacio": "mitjana",
      "zhr": { "valor": 5, "qualificador": "estimat" },
      "radiant_maxim": { "ascensio_recta_graus": 262, "declinacio_graus": 54 },
      "textos": { "ca": { "nota_visibilitat": "Observable des de Catalunya, però amb poca activitat habitual i sense cap augment previst per al 2026.", "consell_observacio": "Proveu-ho al vespre del 9 d'octubre des d'un cel fosc i valoreu-la com una observació pacient, no com una pluja intensa." } },
      "font_codi": "imo-2026", "referencia_font": "Taula 5 i apartat Draconids"
    },
    {
      "codi": "orionids-2026", "fenomen_codi": "orionids",
      "inici": "2026-10-02T00:00:00Z", "fi": "2026-11-07T23:59:59Z", "maxim": "2026-10-21T12:00:00Z",
      "precisio": { "inici": "dia", "fi": "dia", "maxim": "dia" },
      "rellevant_catalunya": true, "rellevancia": "principal", "dificultat_observacio": "mitjana",
      "zhr": { "valor": 20, "qualificador": "minim" },
      "radiant_maxim": { "ascensio_recta_graus": 95, "declinacio_graus": 16 },